{
  "$schema": "https://json-schema.org/draft/2020-12/schema",
  "$id": "https://github.com/zwbao/longevity-skills/schema/skill.schema.json",
  "title": "longevity-skills skill.json v1",
  "description": "One machine-readable manifest per skill directory. The registry, catalog.json, README skill list, paper card, and input checks are generated from it. Conditional rules (kind and tier, paper or tool block, verified inputs) are enforced by tools/lsk/manifest.py.",
  "type": "object",
  "required": [
    "schema",
    "name",
    "kind",
    "tier",
    "species",
    "evidence",
    "domains",
    "blurb_zh",
    "intents"
  ],
  "additionalProperties": false,
  "properties": {
    "$schema": {
      "type": "string"
    },
    "schema": {
      "const": "longevity-skill/1"
    },
    "name": {
      "type": "string",
      "pattern": "^[a-z0-9][a-z0-9-]*$"
    },
    "kind": {
      "enum": [
        "paper",
        "tool",
        "evidence"
      ]
    },
    "tier": {
      "description": "A: computes a personal readout from inputs a person can obtain. B: evidence or named lists a person can look up. C: indexed only, not dispatched for personal questions. tool: wraps a published program, database, or the evidence store.",
      "enum": [
        "A",
        "B",
        "C",
        "tool"
      ]
    },
    "species": {
      "description": "Every organism or system the paper's own experiments used, not only the one the skill reads: a human cohort plus mouse experiments is [\"human\", \"mouse\"]; human cells grafted into mice add mouse. cell_line covers cultured cells and organoids. Tier follows the human data the personal readout uses; species and evidence describe the paper.",
      "type": "array",
      "minItems": 1,
      "uniqueItems": true,
      "items": {
        "enum": [
          "human",
          "mouse",
          "rat",
          "naked_mole_rat",
          "c_elegans",
          "drosophila",
          "zebrafish",
          "killifish",
          "planarian",
          "butterfly",
          "bowhead_whale",
          "primate",
          "yeast",
          "cell_line",
          "multi_species",
          "other"
        ]
      }
    },
    "evidence": {
      "description": "The design behind the paper's main conclusion, the one summary_zh states first, not the source of the data the skill reads. rct: the conclusion is a pre-specified primary outcome of a randomized trial. rct_secondary: a post hoc, secondary or exploratory analysis of trial samples. cohort, case_control, cross_sectional: human observational designs, judged by the main analysis (a single blood draw compared across ages is cross_sectional even when the participants come from a cohort). animal: the main conclusion comes from animal experiments, including mostly-animal papers with some human data. in_vitro: cells, organoids or cell-free assays. review: a narrative or systematic review with no new data. consensus: an expert consensus or guideline statement. method: a measurement or analysis method. database: a resource paper that publishes a database.",
      "enum": [
        "rct",
        "rct_secondary",
        "cohort",
        "case_control",
        "cross_sectional",
        "animal",
        "in_vitro",
        "review",
        "method",
        "database",
        "consensus"
      ]
    },
    "domains": {
      "type": "array",
      "minItems": 1,
      "items": {
        "type": "string",
        "minLength": 1,
        "maxLength": 20
      }
    },
    "blurb_zh": {
      "type": "string",
      "minLength": 2,
      "maxLength": 200
    },
    "intents": {
      "type": "array",
      "uniqueItems": true,
      "items": {
        "type": "string",
        "pattern": "^[a-z][a-z_]*$"
      }
    },
    "triage": {
      "$ref": "#/$defs/triage"
    },
    "paper": {
      "$ref": "#/$defs/paper"
    },
    "tool": {
      "$ref": "#/$defs/tool"
    },
    "entry": {
      "$ref": "#/$defs/entry"
    },
    "population": {
      "$ref": "#/$defs/population"
    },
    "inputs_status": {
      "enum": [
        "none",
        "draft",
        "verified"
      ]
    },
    "inputs": {
      "type": "array",
      "items": {
        "$ref": "#/$defs/input"
      }
    },
    "outputs": {
      "type": "array",
      "items": {
        "$ref": "#/$defs/output"
      }
    },
    "related_not_same": {
      "type": "array",
      "uniqueItems": true,
      "items": {
        "type": "string",
        "pattern": "^[a-z0-9][a-z0-9-]*$"
      }
    },
    "data_files": {
      "type": "array",
      "items": {
        "$ref": "#/$defs/data_file"
      }
    },
    "validation": {
      "description": "How the personal readout was checked. Required for tier A. reproduced: at least one number the paper prints (a worked example, a table of predicted values, per-term scores) is reproduced by a named test; the quote holds the printed text and the test file holds the same numbers. reproduced_secondary: the paper prints no worked example, and the readout agrees case by case with at least two independent implementations, or reproduces a population summary statistic the paper (or the same group's follow-up) prints; each check is a comparison with its source (implementation name and version or commit, or the paper locator and quote) and a named test. It is shown as 已与独立实现核对, never as a reproduction of the paper. draft: not reproduced yet; gap_zh says what is missing and where it was looked for.",
      "type": "object",
      "additionalProperties": false,
      "required": [
        "status"
      ],
      "properties": {
        "status": {
          "enum": [
            "reproduced",
            "reproduced_secondary",
            "draft"
          ]
        },
        "examples": {
          "type": "array",
          "items": {
            "type": "object",
            "additionalProperties": false,
            "required": [
              "locator",
              "quote",
              "values",
              "test"
            ],
            "properties": {
              "locator": {
                "type": "string",
                "minLength": 2,
                "description": "Where the paper prints it: Table 2, Supplementary Table 1, Results paragraph 3, worked example in Methods."
              },
              "quote": {
                "type": "string",
                "minLength": 5,
                "maxLength": 600,
                "description": "The printed text or table cells, verbatim, containing every value."
              },
              "values": {
                "type": "array",
                "minItems": 1,
                "items": {
                  "type": "number"
                },
                "description": "The printed numbers the test asserts."
              },
              "tolerance": {
                "type": "string",
                "description": "How close the test requires, and why (rounding in the paper)."
              },
              "test": {
                "type": "string",
                "pattern": "^tests/[^:]+\\.py::[A-Za-z_][A-Za-z0-9_]*$"
              }
            }
          }
        },
        "comparisons": {
          "type": "array",
          "description": "reproduced_secondary only: the checks against independent implementations or printed population summaries.",
          "items": {
            "type": "object",
            "additionalProperties": false,
            "required": [
              "kind",
              "source",
              "locator",
              "values",
              "test"
            ],
            "properties": {
              "kind": {
                "enum": [
                  "implementation",
                  "population_summary"
                ]
              },
              "source": {
                "type": "string",
                "minLength": 5,
                "description": "implementation: package or program, its version and commit or file hash (e.g. pyaging 0.5.7, PyPI wheel sha256 ...). population_summary: the paper (DOI) that prints the statistic, and the public data the test recomputes it on."
              },
              "locator": {
                "type": "string",
                "minLength": 2,
                "description": "implementation: the function or file that computes it (e.g. pyaging.models.PhenoAge). population_summary: where the paper prints it."
              },
              "quote": {
                "type": "string",
                "minLength": 5,
                "maxLength": 600,
                "description": "population_summary: the printed text, verbatim, containing every value."
              },
              "values": {
                "type": "array",
                "minItems": 1,
                "items": {
                  "type": "number"
                },
                "description": "implementation: its outputs for the test cases. population_summary: the printed numbers. The test file holds the same numbers."
              },
              "tolerance": {
                "type": "string",
                "description": "How close the test requires, and why."
              },
              "test": {
                "type": "string",
                "pattern": "^tests/[^:]+\\.py::[A-Za-z_][A-Za-z0-9_]*$"
              }
            }
          }
        },
        "gap_zh": {
          "type": "string",
          "minLength": 5
        }
      }
    }
  },
  "$defs": {
    "triage": {
      "type": "object",
      "required": [
        "reason_zh",
        "reviewed"
      ],
      "additionalProperties": false,
      "properties": {
        "reason_zh": {
          "type": "string",
          "minLength": 4,
          "maxLength": 300
        },
        "reviewed": {
          "type": "boolean"
        },
        "reviewer": {
          "type": "string"
        }
      }
    },
    "paper": {
      "type": "object",
      "required": [
        "title_zh",
        "summary_zh",
        "summary_status"
      ],
      "additionalProperties": false,
      "properties": {
        "doi": {
          "type": "string",
          "pattern": "^10\\.[0-9]{4,9}/[^\\s。，；]+$"
        },
        "source_id": {
          "type": "string",
          "minLength": 3
        },
        "title": {
          "type": "string",
          "minLength": 4
        },
        "title_zh": {
          "type": "string",
          "minLength": 2,
          "maxLength": 60
        },
        "journal": {
          "type": "string",
          "minLength": 2
        },
        "year": {
          "description": "The citation year: the year of the volume or issue the paper is in (Nature Aging 4:110-128 is 2024 even though it went online in December 2023). Use the online year only while the paper is not in an issue yet. claims.md and SKILL.md cite the same year.",
          "type": "integer",
          "minimum": 1900,
          "maximum": 2100
        },
        "authors": {
          "description": "One author: the family name. Two: 「A 与 B」. Three or more: 「A 等」.",
          "type": "string",
          "minLength": 2
        },
        "article_url": {
          "type": "string",
          "pattern": "^https?://"
        },
        "supplements": {
          "type": "array",
          "items": {
            "type": "object",
            "required": [
              "url"
            ],
            "additionalProperties": false,
            "properties": {
              "label": {
                "type": "string"
              },
              "url": {
                "type": "string",
                "pattern": "^https?://"
              }
            }
          }
        },
        "code_url": {
          "type": "string",
          "pattern": "^https?://"
        },
        "card_notes": {
          "type": "array",
          "items": {
            "type": "string",
            "minLength": 1
          }
        },
        "summary_zh": {
          "description": "Two sentences for an ordinary reader. First: what the study found, naming the organism (人、小鼠、线虫…) and, for trial re-analyses, 事后分析 or 二次分析. Second: what the personal report computes and does not compute. No result numbers, advice, user-facing disclaimers (the boundary sentence belongs in the report), or tool, package, function or repository names.",
          "type": "string",
          "minLength": 40,
          "maxLength": 400
        },
        "summary_status": {
          "enum": [
            "draft",
            "reviewed"
          ]
        }
      }
    },
    "tool": {
      "type": "object",
      "required": [
        "upstream"
      ],
      "additionalProperties": false,
      "properties": {
        "upstream": {
          "type": "string",
          "pattern": "^https?://"
        },
        "version": {
          "type": "string"
        },
        "commit": {
          "type": "string"
        },
        "license": {
          "type": "string"
        },
        "requires": {
          "type": "array",
          "items": {
            "type": "string"
          }
        },
        "doi": {
          "type": "string",
          "pattern": "^10\\.[0-9]{4,9}/\\S+$"
        }
      }
    },
    "population": {
      "type": "object",
      "description": "Who the equation was fit on. Callers warn when the person is outside age_years even if an input range still accepts the value.",
      "required": [
        "age_years"
      ],
      "additionalProperties": false,
      "properties": {
        "age_years": {
          "type": "array",
          "minItems": 2,
          "maxItems": 2,
          "items": {
            "type": "number"
          },
          "description": "Inclusive derivation ages in years, low then high."
        },
        "note_zh": {
          "type": "string",
          "minLength": 4,
          "maxLength": 300
        }
      }
    },
    "entry": {
      "type": "object",
      "required": [
        "script"
      ],
      "additionalProperties": false,
      "properties": {
        "script": {
          "type": "string",
          "pattern": "^scripts/[A-Za-z0-9._-]+\\.py$"
        },
        "runtime": {
          "type": "string",
          "pattern": "^[a-z0-9_-]+$"
        },
        "measurements_flag": {
          "type": "string",
          "pattern": "^--[a-z0-9-]+$"
        },
        "measurements_header": {
          "type": "array",
          "minItems": 2,
          "maxItems": 3,
          "items": {
            "type": "string"
          }
        },
        "age_flag": {
          "type": "string",
          "pattern": "^--[a-z0-9-]+$"
        },
        "sex_flag": {
          "type": "string",
          "pattern": "^--[a-z0-9-]+$"
        },
        "medications_flag": {
          "type": "string",
          "pattern": "^--[a-z0-9-]+$"
        },
        "labs_flag": {
          "type": "string",
          "pattern": "^--[a-z0-9-]+$"
        },
        "out_flag": {
          "type": "string",
          "pattern": "^--[a-z0-9-]+$"
        },
        "result_json": {
          "type": "boolean"
        },
        "targets_flag": {
          "type": "string",
          "pattern": "^--[a-z0-9-]+$",
          "description": "Flag for a CSV of target values (same columns as the measurements file). The script then writes out/levers.json: the model at the targets and the change from moving each input alone."
        },
        "levers_json": {
          "type": "boolean",
          "description": "The script writes out/levers.json (schema longevity-levers/1): per-input sensitivities at the current values and, with targets, per-input levers."
        }
      }
    },
    "input": {
      "type": "object",
      "required": [
        "key",
        "label_zh",
        "required",
        "from"
      ],
      "additionalProperties": false,
      "properties": {
        "key": {
          "type": "string",
          "pattern": "^[A-Za-z][A-Za-z0-9_]*$"
        },
        "label_zh": {
          "type": "string",
          "minLength": 1
        },
        "aliases": {
          "type": "array",
          "uniqueItems": true,
          "items": {
            "type": "string",
            "minLength": 1
          }
        },
        "loinc": {
          "type": "array",
          "uniqueItems": true,
          "items": {
            "type": "string",
            "pattern": "^[0-9]{1,7}-[0-9]$"
          }
        },
        "unit": {
          "type": "string"
        },
        "accept": {
          "type": "object",
          "additionalProperties": {
            "type": "number",
            "exclusiveMinimum": 0
          }
        },
        "molar_mass": {
          "type": "number",
          "exclusiveMinimum": 0
        },
        "range": {
          "type": "array",
          "minItems": 2,
          "maxItems": 2,
          "items": {
            "type": "number"
          }
        },
        "unit_required": {
          "type": "boolean",
          "description": "A row named by a label or alias must state its unit. Use when a common wrong unit still lands inside range (CRP mg/L vs mg/dL)."
        },
        "required": {
          "type": "boolean"
        },
        "from": {
          "enum": [
            "measurements",
            "profile",
            "argument",
            "output"
          ]
        },
        "flag": {
          "type": "string",
          "pattern": "^--[a-z0-9-]+$"
        },
        "output_of": {
          "type": "array",
          "items": {
            "type": "string"
          }
        },
        "group": {
          "type": "string"
        },
        "note_zh": {
          "type": "string"
        }
      }
    },
    "output": {
      "type": "object",
      "required": [
        "key",
        "label_zh"
      ],
      "additionalProperties": false,
      "properties": {
        "key": {
          "type": "string",
          "pattern": "^[a-z][a-z0-9_]*$"
        },
        "label_zh": {
          "type": "string",
          "minLength": 1
        },
        "unit": {
          "type": "string"
        },
        "note_zh": {
          "type": "string"
        }
      }
    },
    "data_file": {
      "type": "object",
      "required": [
        "path",
        "redistributable"
      ],
      "additionalProperties": false,
      "properties": {
        "path": {
          "type": "string"
        },
        "source_url": {
          "type": "string",
          "pattern": "^https?://"
        },
        "license": {
          "type": "string"
        },
        "sha256": {
          "type": "string",
          "pattern": "^[0-9a-f]{64}$"
        },
        "redistributable": {
          "enum": [
            "yes",
            "no",
            "unknown"
          ]
        }
      }
    }
  }
}
